tempo,estrelas,avaliacao,Local Guide,Avaliacoes,Classificacoes,Fotos,Videos,Legendas,Respostas,Edicoes,Informadas como Incorretas,Lugares Adicionadas,Estradas Adicionadas,Informacoes Verificadas,P/R,Previsao_Fraude_RF
10 meses atrás,3,"E o que dizer do Animus: fui à convite de amigos; ao entrar, a  impressão de estar indo para uma ótima experiência..Bem decorado, envidraçado, paredes revestidas de bela renda - talvez nordestina - e ao fundo tocava Los Sebosos Postiços - tudo de bom. Talvez em um volume um pouco acima do meu ideal.  À mesa, bela louça, cardápio executivo enxuto, alma brasileira e autoexplicativo, e uso o termo pois, mesmo assim, veio a surpresa.: a atendente responsável pela nossa mesa questionou se conhecíamos a casa; com a nossa negativa iniciou-se uma explicação rígida e cansativa sobre o menu e ao fim uma pergunta se já queriamos pedir.  Eramos 9 pessoas, queríamos conversar um pouco, negamos. Ao chamarmos para fazer os pedidos, nova surpresa..Todos os pedidos - bebidas e pratos - foram checados em voz alta em ""triple check"" nos detalhes, como a mesma nos falou. Ufa! A conversa entre os 9 já era.  As entradas bem montadas e saborosas, agradaram. Vamos ao principal:  dos 4 pratos de carne, 3 vieram com ponto errado. Os pratos de peixe com massa, molho de limão e caulis de Cambuci estavam bem montados, mas faltou sabor, talvez sal.  Pelo erro do ponto da carne, depois de duas abordagens durante o almoço sobre o tema, nos ofereceram uma cortesia em uma sobremesa extra que também não agradou geral. Um creme brulet com bacuri.  Deixou a impressão de muita rigidez, a tentativa de demonstrar muito profissionalismo, não correspondido no sabor, retirando daquele momento a leveza que desejávamos e que uma boa mesa merece. Rolou desânimo.",True,186,86,402,11,0,435,13,0,0,0,0,0,0
10 meses atrás,5,"Ambiente extremamente confortável, adoro que a cozinha seja aberta, mas o salão silencioso, staff muito educado, serviço fino e gentil.  A comida é de uma elegância, criatividade e leveza especial. Os pratos geralmente tem protagonismo vegetal com combinações surpreendentes que ficam na memória.  Por serem muito criativos, alguns pratos podem parecer muito diferentes a algumas pessoas, é preciso provar com a mente aberta. Eu diria que a técnica é precisa e o Animus entrega mais do que promete.  Para quem quer economizar, o almoço executivo vale muito a pena, não deixa a desejar do cardápio a la carte. Recomendo os bolinhos fritos, os legumes, massas, carnes e sobremesas. Ou seja, é tudo muito bem executado!",True,24,3,10,0,0,23,0,0,0,0,0,2,0
10 meses atrás,5,"Experiência incrível do início ao fim. Todos os pratos são muito saborosos e lindos, além do atendimento impecável da equipe. Com certeza vou voltar pra conhecer ainda mais o cardápio! A proposta de servirem pratos pequenos para compartilhar torna a degustação interessante, já que cada sabor surpreende de um jeito diferente. Eu amei poder experimentar tantos sabores diferentes num único jantar, mas o polvo com arroz negro ganhou um lugar especial no meu coração 💕.",True,46,27,70,0,0,109,0,0,1,0,0,0,0
11 meses atrás,5,"Sensacional. Mas fica uma dica, essencial e de alguém que não é vegano: não pulem os vegetais!",False,4,7,0,0,0,23,0,0,0,0,0,0,0
11 meses atrás,5,,True,5,62,59,0,0,223,5,0,0,0,0,0,0
11 meses atrás,5,"Excelente restaurante! A vagem e o polvo com arroz negro são imbatíveis! Você não pode deixar de conhecer a vagem, prato autoral e especial. Inesquecível!",False,1,0,1,0,0,3,0,0,0,0,0,0,1
11 meses atrás,5,"O restaurante verdadeiramente oferece uma experiência, os pratos não são tão grandes e tem o objetivo de serem divididos, para que possamos provar a maior quantidade de opções. A atenção e gentileza dos atendentes é algo que por si só já valia as 5 estrelas. O T-bone de coerdeiro é incrível e vale experimentar. Em hipótese alguma deixe de experimentar o “bolinho de azeite”! Simplesmente das melhores sobremesas que já tive o prazer de conhecer! Apesar do nome não ser habitual, “incrível” é pouco para descrever este doce.",True,181,18,471,19,0,1295,5,0,2,0,4,3,0
11 meses atrás,4,,True,229,204,806,40,0,1621,6,0,2,0,57,0,0
11 meses atrás,5,"Lugar super aconchegante, atendimento excepcional e comida surpreendente. As entradas e pratos são relativamente pequenos, então experimentei várias opções. Tudo muito gostoso!",False,19,0,9,0,0,85,0,0,0,0,0,0,0
11 meses atrás,5,Local incrível amei cada prato foi servido !,True,10,61,13,3,0,285,0,0,0,0,0,1,0
11 meses atrás,5,,True,9,4,5,0,0,26,0,0,0,0,0,1,0
11 meses atrás,5,,True,50,241,211,4,0,716,3,0,1,0,11,0,0
11 meses atrás,5,"Restaurante com uma proposta interessante para compartilhamento de pratos. A comida é realmente incrível, ótimos sabores, combinações inusitadas e valorização de ingredientes que normalmente passam batido. A vagem é obrigatória mas as outras sugestões da equipe também mantiveram o alto nível. Ótimo ambiente para curtir um bom bate papo enquanto você explora um cardápio enxuto mas bem equilibrado",True,167,210,392,5,0,2533,134,0,0,0,15,50,0
11 meses atrás,5,,False,9,11,0,0,0,62,0,0,0,0,0,0,0
11 meses atrás,5,,True,38,89,29,1,0,297,1,0,0,0,0,3,0
um ano atrás,2,"Não vale a pena. Comida mediana, porções pequenas e caras. Tem outras opções na região que servem comidas melhores e que vão satisfazer mais, principalmente se você gosta de comer porções bem servidas. As fotos do cardápio não condizem com a realidade.",False,8,0,0,0,0,25,0,0,0,0,1,0,1
um ano atrás,5,,True,0,1,0,0,0,3,0,0,0,0,0,0,1
um ano atrás,3,,True,44,75,0,0,0,142,1,0,0,0,0,0,0
um ano atrás,5,Digno de uma chefe diferenciada. Muito obrigado.,False,18,2,0,0,0,72,0,0,0,0,0,0,0
um ano atrás,5,Ótima ideia dos pratos serem menores no intuito de poder experimentar mais opções e dividir,False,11,8,20,0,0,73,0,0,0,0,0,0,0
um ano atrás,5,"Excelente restaurante! O conceito são pratos diversos para que a mesa tenha várias experiências. O Brandade de Bacalhau estava perfeito! O polvo na brasa veio no ponto com arroz muito bem temperado. Recomendo demais!!  A cozinha é aberta e tem vários cozinheiros pro tamanho pequeno da casa, o que é muito bom - oportunidade para novos profissionais. A equipe trabalha em sinergia, cozinha limpa e em som ambiente.  A decoração é bonita e moderna. Foi minha primeira vez e com certeza voltarei. A média de preços dos pratos é $60 e aceita Alelo.  Parabéns a todo o time!",False,35,8,50,2,0,80,0,0,0,0,0,0,0
um ano atrás,5,Desde o atendimento antes de chegarmos ao restaurante até o tempo que passamos lá foi muito agradável. Pedimos o menu degustação quando fomos em outubro de 2022 e foi uma experiência maravilhosa!,True,66,61,0,0,0,84,0,0,1,0,0,0,0
um ano atrás,4,"Entradas e prato principal maravilhosos, mas a sobremesa deixou mto a desejar. Era um mousse de pipoca com lavanda mas tinha mta lavanda parece que estávamos comendo perfume. Mas tirando isso estafa td perfeito",True,53,5,91,0,0,157,0,0,0,0,0,0,0
um ano atrás,5,,True,14,12,0,0,0,93,0,0,0,0,0,0,0
um ano atrás,4,,True,15,2,337,3,3,401,0,0,0,0,0,1,0
um ano atrás,5,Comida muito boa. Excelente atendimento. Preço alto.,True,84,44,0,0,0,47,0,0,0,0,0,1,0
um ano atrás,3,,True,4,5,4,0,0,143,0,0,1,0,35,0,0
um ano atrás,5,"Ambiente gostoso, comida boa e atendimento excelente! Os pratos são pequenos, é preciso pedir em torno de uns 2-3 por pessoa, mas a proposta de ser menor pra provar de vários é legal! Pratos super elaborados e cheios de sabor, o mais incrível é ver os vegetais brilhando e sendo valorizados. Pro meu paladar, achei tudo um pouco adocicado, o que me faz cansar depois de experimentar vários seguidos, mas quem gosta de sabor mais adocicado vai gostar! Destaque pro arroz bolinha e repolho assado. A equipe é perfeita, todos nos atenderam suuuuper bem! Bem preparados pra receber veganos também!",False,64,2,55,0,0,53,0,0,0,0,0,0,0
um ano atrás,1,"Caro. Comida ruim. Porções extremamente pequenas. Serviço deixa muito a desejar, com cara de pouco caso.... Péssima experiência!!!!",True,88,706,143,5,0,2044,0,0,0,0,1,15,0
um ano atrás,5,"Gostei muito da experiência de petiscar! Pratos diferentes e interessantes! Recomendo MUITO a burrata frita, vagem assada e couve-flor na brasa! Não gostei mt do creme de cogumelos. Ah, as sobremesas são super diferentes! Vale provar :)",True,35,17,86,4,0,96,1,0,0,0,0,0,0
um ano atrás,3,"Fomos em um grupo grande com muita fome sem saber da proposta de pequenas porções para compartilhar, o que acabou sendo frustrante  no dia. Acredito que a experiência seja melhor em grupos pequenos. O ponto alto foi o atendimento, muito atenciosos e amáveis.",True,573,16,2538,23,1,5352,7,0,3,0,44,0,0
um ano atrás,5,"Muito aconchegante, comida maravilhosa, atendimento perfeito.",False,12,0,0,0,0,23,0,0,0,0,0,0,0
um ano atrás,5,,True,33,1086,405,1,0,5564,1,0,0,0,2,0,0
um ano atrás,5,,False,2,11,0,0,0,3,0,0,0,0,0,0,0
um ano atrás,4,"Quer ter um almoço de negócios num local agradável, confortável e comida da melhor qualidade: Animus.",True,67,10,42,0,0,244,0,0,0,0,0,3,0
um ano atrás,3,,True,35,289,41,0,0,699,4,0,0,0,13,4,0
um ano atrás,4,,True,52,25,5,0,0,119,1,0,0,0,2,1,0
um ano atrás,5,,True,8,121,275,1,0,636,0,0,0,0,0,0,0
um ano atrás,5,,False,3,40,75,1,0,375,0,0,0,0,0,0,0
um ano atrás,5,"Comida: excelente, maravilhosa. Atendimento: excelente, muito prestativo e atencioso. Explicaram toda a proposta do restaurante. Local: excelente, agradável.",True,62,75,2,0,0,72,0,0,0,0,0,0,0
um ano atrás,5,"Que ótimo dar 5 estrelas e sair de uma refeição feliz. Almocei durante a semana, então escolhi o menu executivo - entrada (bolinho de linguiça delicioso), prato principal escolhi o nhoque frito com frutos do mar (muito bem feito, ótimos sabores) e para a sobremesa um bolinho de milho (parece um curau mais rustico) com molho de caramelo surpreendeu positivamente. Vale muito a visita, vá com calma para desfrutar o local muito agradável, música boa e ótimo serviço.",True,351,69,751,11,3,768,23,0,3,0,19,1,0
um ano atrás,5,,True,13,172,10,1,0,2375,0,0,0,0,0,3,0
um ano atrás,5,,True,31,391,188,3,0,2046,0,0,0,0,0,2,0
um ano atrás,3,A ideia inicial vem se perdendo com o tempo. Preço dobraram em pouco mais de um ano. A proposta de pratos pequenos para degustar vários sabores se perdeu com o aumento excessivo dos preços. Carta de vinhos cara. Garçons mudam muito rapidamente e são sempre novos com um treinamento ruim.,True,61,11,18,0,0,210,0,0,0,0,0,0,0
um ano atrás,5,,True,2,8,0,1,0,58,0,0,0,0,0,0,0
um ano atrás,5,"Giovanna e Sofia são fora do comum... Restaurante lindo, pratos com muita técnica e cuidado aos detalhes, a gastronomia tem um pezinho na frança. Vale muito a pena conhecer...",True,186,30,29,3,0,120,0,0,0,0,16,3,0
um ano atrás,5,"Cliente fiel, ambiente perfeito para jantar a dois, luz ambiente, comida sempre excelente, drinks exatamente como descritos na carta.",True,18,21,0,0,0,72,0,0,1,0,0,0,0
um ano atrás,5,A Chef Giovanna Grossi oferece um menu criativo e delicioso de forma autenticamente elegante.  Meu restaurante preferido em São Paulo.,True,21,1,0,0,0,35,0,0,0,0,0,0,0
um ano atrás,4,"Pratos muito bons e atendimento excelente, porém porções muito pequenas.",True,93,85,9,2,0,677,0,0,0,0,1,1,0
um ano atrás,5,,True,64,14,41,0,0,544,0,0,0,0,0,3,0
um ano atrás,1,Porções mínimas e preços absurdos. O sabor das porções não compensa nem de perto o preço. É o tipo de lugar que você precisa de uma lupa para ver a comida. Os drinks que tomamos também não eram muito bons,True,52,41,52,0,0,206,0,0,0,0,0,0,0
um ano atrás,5,"Restaurante da chef Juliana Grossi.  Muito boa a experiência,  os pratos são ótimos e o atendimento excelente.",True,58,152,272,1,0,1262,0,0,0,0,0,21,0
um ano atrás,5,"Incrível o trabalho e a experiência proporcionada pela Animus, frequento desde 2020 um pouco antes da pandemia, já perdi a conta de quantas vezes eu fui!  Ambiente minimalista, mas tudo bem estruturado e pensado, mesmo usando material simples mas casa completamente com a identidade do restaurante  Como sou Vegetariano, lembro que a minha primeira experiência foi o menu degustação Vegetariana, e o que me amarrou com o estabelecimento foi a Vagem Assada com Queijo de Cabra! Lembro que repeti de tão bom que foi!  As porções são pequenas e a proposta do restaurante é compartilhar, e o legal é que tem um serviço volante onde eles oferecem opções limitadas e que não estão no cardápio! Quase tudo o que é vegetariano eles consegue preparar versão vegana.  Fora isso a Chef Giovanna é super simpática e já veio na mesa explicar os conceitos dos pratos e até oferecer cortesia como pedido de desculpas quando houve falha no serviço (o que é raro!)  Recomendo sempre reservar antes, pois passou a ficar bem frequentado e o legal é que o cardápio muda sempre!  O único ponto de melhoria são talvez os drinques, a descrição é muito legal, mas gosto nem tanto. Fora isso é na questão de tempero, se tivesse um pouco mais de flexibilidade com alguns ingredientes como alho, cebola e pimenta (alguns clientes podem ter alergia ou intolerância)  Vida Longa à Animus",True,4,0,13,0,0,18,0,0,0,0,0,0,0
um ano atrás,5,"Incrível!!! Porções pequenas para compartilhar !!! Prepare o bolso, mas vale muito a pena !!!",True,121,3,222,0,0,1252,0,0,1,0,0,1,0
um ano atrás,4,"Eu fiz uma reserva pro sábado, pra tentar usar o 2x1, obviamente esqueci de ler a regra e pra eles só funciona de terça a quinta, o que foi triste já que a ideia era economizar, mas tudo bem, não deixa de ser um ótimo restaurante com um atendimento animado e pratos incríveis.  A ideia do restaurante são pequenos pratos pra dividir, eu tenho dúvida se gosto desse estilo, por que é pouca comida, embora muito boa, gostaria de pedir um pouco mais de algumas porções comer realmente pratos só de uma coisa, depois que você pede vc entende imediatamente que é difícil não fazer mais pedidos os sabores são delicados e muito saboros, além de tudo ainda fica circulando um carrinho com petiscos que é uma tentação a parte.  Nossos pedidos foram massa fresca com ragu de cordeiro e espuma de grana padano picles de cebola e nozes picantes (R$ 46), e eu tenho que dizer, que prato maravilhoso, leve e nossa… muito muito saboroso, difícil pedir só um porque eu comeria uma porção normal sozinha. Também pedimos bochecha de pijupirá (R$ 48) e no começo não achamos nada demais, mas conforme vamos comendo o defumado e sabor te deixam muito envolvidos só é realmente uma porção pequena, pra finalizar pedimos bolinho de mandioca com recheio de cogumelos (R$ 28) de todos o que menos emociona, simples, mas o gosto de tudo é muito leve e eu esperava mais potência.  De drinks pedimos o Odorata (R$ 44) que que é uma delicinha, ele vir defumado é o que faz dele um dos melhores que já tomei.  No total pra cada deu R$ 114, com serviço. Eu ainda fiquei com um pouquinho de fome só não pedimos mais coisas, pois não estávamos preparados pra gastar mais naquele dia, mas com certeza irei voltar lá, e recomendo muito a visita.",True,122,20,408,10,0,1906,1,0,0,0,0,3,0
um ano atrás,5,,True,183,36,189,36,0,86,0,0,0,0,0,2,0
um ano atrás,1,"Não recomendo!!! A chefe q é a dona costuma humilhar os funcionários, relatei com os mesmos...e tb aconteceu comigo mesmo, eu saí chorando desse restaurante!",True,71,42,14,0,0,70,0,0,0,0,0,1,0
um ano atrás,5,Melhor restaurante e comida boa,True,93,34,5,0,0,9,1,0,0,0,25,1,0
um ano atrás,5,"Delícia de lugar pra drinks e petiscos, opções vegetarianas deliciosas",True,12,28,3,0,0,104,0,0,0,0,1,0,0
um ano atrás,5,Um dos melhores jantares de São Paulo.,True,75,10,9,0,0,190,0,0,0,0,1,0,1
um ano atrás,1,Não gostei,False,34,39,0,0,0,50,0,0,0,0,0,0,0
um ano atrás,5,Muito bom o atendimento e a comida. Recomendo!!,False,7,7,0,0,0,13,0,0,0,0,0,0,0
um ano atrás,5,,True,5,57,0,0,0,42,0,0,0,0,0,0,0
um ano atrás,3,"Poucas opções pra veganos, muitos pratos eram ""transformados"" em ""veganos"" por retirada de alguns ingredientes, sem substituir. Isso prejudica muito a experiência.",True,24,18,8,0,0,31,0,0,0,0,0,0,0
um ano atrás,5,Ótima recepção e atendimento impecável!,False,7,2,2,1,0,38,1,0,0,0,0,0,0
um ano atrás,5,Uma verdadeira experiência culinária.,True,48,236,176,0,0,248,0,0,1,0,0,0,0
um ano atrás,5,"Espetacular!! Comida boa, excelente atendimento e um ambiente agradável... Minhas amigas e eu adoramos. ❤️❤️❤️",True,61,31,71,0,0,200,0,0,1,0,0,5,0
um ano atrás,5,,True,13,36,3,0,0,19,0,0,0,0,0,0,0
um ano atrás,5,"Simplesmente AMEI! Adorei a maneira como eles tem entradas extras que ficam passando sempre frescas na mesa, os que pedimos do cardápio também excelentes! Indico demais !!! Funcionários super simpáticos.",True,178,1,617,6,0,385,1,0,2,0,0,0,0
um ano atrás,2,"Apesar da comida ser boa, as porções são extremamente pequenas para o valor cobrado. Fiquei surpreso com a ""massa fresca com cordeiro"" de R$ 50 reais para 3 pequenos pedaços de macarrão, não existe teoria de compartilhamento que justifique esse preço.",False,1,0,0,0,0,2,0,0,0,0,0,0,1
um ano atrás,5,,True,4,80,5,0,0,368,0,0,1,0,0,0,0
um ano atrás,4,"Ambiente legal, comida muito saborosa, atendentes atenciosos e preparados. Porem as porções sao realmente muito pequenas, o preço final acaba ficando alto.",True,50,64,199,1,0,498,1,0,0,0,0,0,0
um ano atrás,5,,True,42,88,4,0,0,806,10,0,0,0,0,0,0
um ano atrás,4,"Grata surpresa na região. É possível comer vários pratos diferentes nesse restaurante, pois as porções são pequenas e feitas para compartilhar. Tem um carrinho que passa pelo restaurante com ótimas opções de comida também. Tudo que eu comi estava gostoso. Boa opção de drinks e a sobremesa estava boa também! O preço é um pouco alto, mas condiz com tudo que é oferecido no local. Staff gentil. Vale conhecer.",True,632,115,118,1,0,1146,1,0,1,0,0,1,0
um ano atrás,5,Excelente!!,True,38,39,0,0,0,30,1,0,0,0,0,0,0
um ano atrás,5,,False,0,1,0,0,0,80,0,0,0,0,0,0,1
um ano atrás,5,,True,9,22,0,0,0,217,0,0,0,0,0,0,0
um ano atrás,5,Uma experiencia gastronômica sensacional. Vale a pena conhecer.,True,22,48,1,0,0,37,1,0,24,0,0,2,0
um ano atrás,5,,True,5,30,0,0,0,38,0,0,0,0,0,0,0
um ano atrás,5,"O restaurante tem a proposta de porções pequenas (assim você pode experimentar uma variedade maior) que são muito boas, e sabores autênticos. Sem falar do serviço do carrinho, que vai passando ao longo do tempo - que é bem bacana.  O atendimento é impecável, todos muito educados e atenciosos. Excelente do começo ao fim, principais, drink e sobremesa!  Nosso destaque fica para o repolho na brasa e para o bolo de azeite.  Há opções veganas* :)",True,47,0,107,3,0,104,2,0,2,0,0,0,0
um ano atrás,4,"pratos pequenos (tamanho de entrada) sob a justificativa de que é ""para compartilhar"";  uma pessoa fica passando com um carrinho e oferecendo opções que não estão no cardápio; a ideia teoricamente é divertida, mas, depois de pouco tempo, fica só irritante a pessoa atrapalhando a sua conversa e vindo, de 10 em 10 minutos, te oferecer coisas que voce não pediu; seria muito mais fácil ter um ""cardápio do dia"" e aquelas opções serem oferecidas desde já aos clientes.  no mais, a comida é boa; o atendimento é muito cordial e solícito; o ambiente é bonito e agradável.",True,222,22,153,0,0,1201,1,0,0,0,0,0,0
um ano atrás,5,Porções deliciosas😍😍,True,61,30,100,0,0,18,0,0,0,0,0,0,0
um ano atrás,5,,True,33,23,9,0,0,359,1,0,0,0,1,0,0
um ano atrás,5,"Ambiente descontraído e super gostoso. O cardápio é bem diverso e com um requinte, beleza e principalmente muito sabor presente.",True,275,4,303,14,1,1130,5,0,1,0,1,1,0
um ano atrás,5,"Lugar excelente para comer pratinhos, comida extremamente saborosa e de qualidade. Recomendo!",True,239,164,1269,16,0,985,2,0,0,0,1,1,0
um ano atrás,5,"Uma das melhores experiências gastronômicas. O ambiente é super agradável, o atendimento é impecável, simpático e atencioso. Todos os pratos que pedimos estavam incríveis, super bem balanceados e com uma mistura de sabores única. O que comemos: burrata frita com tomates caramelizados, vagem assada com couli de azeitona e queijo de ovelha, tartare de alcatra e trio de bolinhos. O que bebemos: Pitanga Sour e o drink de Uvaia Vamos voltar com certeza Fizemos reserva.",True,186,63,625,0,0,1777,0,0,0,0,2,2,0
um ano atrás,2,"A proposta do restaurante é de que todas as entradas e todos os pratos sejam compartilhados. No entanto, é tudo tão pouco que as porções podem ser consideradas individuais “tamanho degustação gourmet”. O flat iron é o mais bem servido. A música é boa.  Há restaurantes bem melhores dentro da mesma faixa de preço.  Fui para casa pedir um pizza para ficar satisfeito.",True,15,0,16,0,0,10,0,0,0,0,0,0,0
um ano atrás,5,,True,20,107,2,0,0,163,0,0,0,0,0,0,0
um ano atrás,5,,True,6,11,60,0,0,12,0,0,0,0,0,1,0
um ano atrás,5,Sem dúvida um dos melhores restaurantes de pinheiros.,False,10,15,0,0,0,59,0,0,0,0,1,0,0
um ano atrás,5,"Restaurante excelente! Ótima comida, ótimo atendimento, bom custo/benefício. Voltarei várias vezes com certeza!",True,67,7,0,0,0,271,0,0,0,0,0,0,0
um ano atrás,5,,True,13,227,0,0,0,2717,0,0,0,0,0,0,0
um ano atrás,1,Gastar 400 o casal e sair com fome num almoço de sábado. Essa é a proposta. Porções extremamente pequenas com preço de prato de outros restaurantes até melhores. Não voltaria.,True,32,5,1,0,0,31,23,0,0,0,0,0,0
um ano atrás,5,"Que restaurante maravilhoso! Entramos no restaurante por acaso, e fomos muito bem recebidos por João, uma simpatia. Ao longo da noite, nos maravilhamos com os pratos - em especial o gnocchi e a vagem, que eu poderia comer todos os dias facilmente sem enjoar! E com drinks deliciosos criados pela simpaticissima Vanessa e seu time. Recomendo o de pitanga! Vale cada centavo. Tudo é muito, muito bom e bem executado. Muito sucesso à casa e à equipe!",True,14,3,2,0,0,28,0,0,0,0,0,0,0
um ano atrás,5,,True,39,141,65,0,0,339,7,0,7,1,0,0,0
um ano atrás,5,,True,3,61,0,0,0,63,0,0,0,0,0,0,0
um ano atrás,5,"Comida sensacional, atendimento mais ainda, ambiente aconchegante",False,3,1,0,0,0,26,0,0,0,0,0,0,0
um ano atrás,4,Ótima comida. Porções pequenas.,True,28,12,5,0,0,98,0,0,0,0,0,0,0
um ano atrás,5,,True,48,166,288,47,1,1787,0,0,0,0,0,3,0
um ano atrás,5,,False,1,5,0,0,0,9,0,0,0,0,0,0,1
um ano atrás,5,"Da surpreendente comida, coquetéis autorais ao espaço intimista e atendimento de primeira fez o Animus estar entre meus restaurantes favoritos de São Paulo. Não vejo a hora de voltar!",True,54,9,46,3,0,146,0,0,1,0,0,0,0
um ano atrás,4,,True,79,193,2082,310,0,899,2,1,5,0,0,0,0
um ano atrás,5,"Já fui no almoço e no jantar; ambas experiências impecáveis em termos de comida e atendimento. A proposta é muito criativa: no lugar de pratos individuais, o menu privilegia porções para compartilhar, com ingredientes sempre frescos e alguns regionais. Se você não for de São Paulo e quiser comer bem, no lugar de ir pegar fila e ser mal atendido no restaurante do ex-participante-do-Masterchef da vez, dê uma chance ao Animus e eu garanto que você volta com uma boa história para contar.",True,38,1,0,0,0,45,0,0,0,0,1,0,0
um ano atrás,4,"Gostoso, uma comida diferente é só mesmo tempo simples",True,97,9,10,0,0,38,0,0,0,0,0,0,0
um ano atrás,5,,False,0,1,0,0,0,3,0,0,0,0,0,0,1
um ano atrás,5,Incrível,False,60,107,14,0,0,228,0,0,0,0,0,0,0
um ano atrás,5,"Alegria! Resultado final da experiência. Alimentos delicadamente harmonizados que explodem no paladar. Cumprem o propósito da casa, que gentilmente é explicado na chegada: valorizar sabores de maneira autoral. Amamos cada detalhe da burrata frita, com tomatinhos e pesto, como nunca experimentei. As vagens… o que é isso! Jaboticaba mule precisa ser provada! Incrivelmente suave! Tudo surpreendeu. O peixe ganha leveza e já do consumido com cada detalhe que o acompanha. A espuma de pudim… que criatividade divina! Parabéns!!! Senti nessa visita o sentido de cada escolha da chef! Parabéns a toda equipe! Fiquei fã!!!",True,250,14,1776,17,5,1108,1,0,1,0,1,10,0
um ano atrás,3,"Bom restaurante, ótima proposta.",True,318,50,342,0,0,298,8,0,1,0,0,1,0
um ano atrás,5,,True,84,156,337,14,1,1058,2,0,0,0,1,3,0
um ano atrás,5,Sensacional,True,29,7,70,7,0,75,1,0,0,0,0,0,0
um ano atrás,5,"Ótimo ambiente, culinária Brasileira com cardápio autoral de excelente bom gosto, recomendo!!!",False,3,0,0,0,0,3,0,0,0,0,0,0,1
um ano atrás,4,,True,24,34,54,0,0,136,1,0,0,0,1,0,0
um ano atrás,5,,True,57,288,175,0,0,550,2,0,1,0,2,0,0
um ano atrás,4,"Gostei bastante da proposta de ter várias comidas em pequenas porções para compartilhar. Além disso, tem um carrinho que passa todo o tempo oferecendo algo inusitado. Achei o serviço um pouco atrapalhado e várias vezes tínhamos que chamar o garçom pq estávamos esquecidos em nosso lugar. No dia da reseva, coloquei que seria um aniversário, e ninguém também se atentou a este detalhe. Por ser um restaurante com um ticket médio alto, todo o detalhe e carinho fazem a diferença.",True,258,64,46,0,0,990,3,0,0,0,0,1,0
um ano atrás,5,Incrível!,True,51,19,23,0,0,164,1,0,0,0,0,0,0
um ano atrás,5,,False,9,89,0,0,0,36,3,0,0,0,0,0,0
um ano atrás,5,,True,43,282,495,1,1,10,0,0,1,0,0,0,0
um ano atrás,5,,True,11,112,3,0,0,2413,0,0,0,0,0,3,0
